[
  {
    "query_id": "q-001",
    "group": "single_class",
    "question": "Which recordings contain vehicle pass-by?",
    "question_vi": "Bản ghi nào có tiếng xe chạy qua?",
    "filters": {
      "classes_all": [
        "vehicle_pass_by"
      ]
    },
    "support_train": 80,
    "relevance": {
      "type": "recording_ids",
      "source": "ground_truth"
    }
  },
  {
    "query_id": "q-002",
    "group": "single_class",
    "question": "Which recordings contain voices?",
    "question_vi": "Bản ghi nào có tiếng người nói?",
    "filters": {
      "classes_all": [
        "voices"
      ]
    },
    "support_train": 80,
    "relevance": {
      "type": "recording_ids",
      "source": "ground_truth"
    }
  },
  {
    "query_id": "q-003",
    "group": "single_class",
    "question": "Which recordings contain train?",
    "question_vi": "Bản ghi nào có tiếng tàu hỏa?",
    "filters": {
      "classes_all": [
        "train"
      ]
    },
    "support_train": 69,
    "relevance": {
      "type": "recording_ids",
      "source": "ground_truth"
    }
  },
  {
    "query_id": "q-004",
    "group": "single_class",
    "question": "Which recordings contain workshop?",
    "question_vi": "Bản ghi nào có tiếng máy móc của xưởng hoặc công trình?",
    "filters": {
      "classes_all": [
        "workshop"
      ]
    },
    "support_train": 55,
    "relevance": {
      "type": "recording_ids",
      "source": "ground_truth"
    }
  },
  {
    "query_id": "q-005",
    "group": "single_class",
    "question": "Which recordings contain propeller aircrafts?",
    "question_vi": "Bản ghi nào có tiếng máy bay cánh quạt hoặc trực thăng?",
    "filters": {
      "classes_all": [
        "propeller_aircrafts"
      ]
    },
    "support_train": 52,
    "relevance": {
      "type": "recording_ids",
      "source": "ground_truth"
    }
  },
  {
    "query_id": "q-006",
    "group": "single_class",
    "question": "Which recordings contain sirens and alarms?",
    "question_vi": "Bản ghi nào có âm thanh giống còi hú hoặc chuông báo động?",
    "filters": {
      "classes_all": [
        "sirens_and_alarms"
      ]
    },
    "support_train": 50,
    "relevance": {
      "type": "recording_ids",
      "source": "ground_truth"
    }
  },
  {
    "query_id": "q-007",
    "group": "single_class",
    "question": "Which recordings contain birds?",
    "question_vi": "Bản ghi nào có tiếng chim?",
    "filters": {
      "classes_all": [
        "birds"
      ]
    },
    "support_train": 47,
    "relevance": {
      "type": "recording_ids",
      "source": "ground_truth"
    }
  },
  {
    "query_id": "q-008",
    "group": "single_class",
    "question": "Which recordings contain vehicle idling?",
    "question_vi": "Bản ghi nào có tiếng động cơ xe chạy không tải?",
    "filters": {
      "classes_all": [
        "vehicle_idling"
      ]
    },
    "support_train": 47,
    "relevance": {
      "type": "recording_ids",
      "source": "ground_truth"
    }
  },
  {
    "query_id": "q-009",
    "group": "single_class",
    "question": "Which recordings contain jet aircrafts?",
    "question_vi": "Bản ghi nào có tiếng máy bay phản lực?",
    "filters": {
      "classes_all": [
        "jet_aircrafts"
      ]
    },
    "support_train": 43,
    "relevance": {
      "type": "recording_ids",
      "source": "ground_truth"
    }
  },
  {
    "query_id": "q-010",
    "group": "single_class",
    "question": "Which recordings contain horn?",
    "question_vi": "Bản ghi nào có tiếng còi xe?",
    "filters": {
      "classes_all": [
        "horn"
      ]
    },
    "support_train": 37,
    "relevance": {
      "type": "recording_ids",
      "source": "ground_truth"
    }
  },
  {
    "query_id": "q-011",
    "group": "single_class",
    "question": "Which recordings contain dog barkings and howlings?",
    "question_vi": "Bản ghi nào có tiếng chó sủa hoặc tru?",
    "filters": {
      "classes_all": [
        "dog_barkings_and_howlings"
      ]
    },
    "support_train": 34,
    "relevance": {
      "type": "recording_ids",
      "source": "ground_truth"
    }
  },
  {
    "query_id": "q-012",
    "group": "single_class",
    "question": "Which recordings contain cicadas and crickets?",
    "question_vi": "Bản ghi nào có tiếng côn trùng như ve sầu hoặc dế?",
    "filters": {
      "classes_all": [
        "cicadas_and_crickets"
      ]
    },
    "support_train": 29,
    "relevance": {
      "type": "recording_ids",
      "source": "ground_truth"
    }
  },
  {
    "query_id": "q-013",
    "group": "single_class",
    "question": "Which recordings contain lawn mower brush cutter and olive shaker?",
    "question_vi": "Bản ghi nào có tiếng máy làm vườn như máy cắt cỏ hoặc máy phát cỏ?",
    "filters": {
      "classes_all": [
        "lawn_mower_brush_cutter_olive_shaker"
      ]
    },
    "support_train": 27,
    "relevance": {
      "type": "recording_ids",
      "source": "ground_truth"
    }
  },
  {
    "query_id": "q-014",
    "group": "single_class",
    "question": "Which recordings contain music?",
    "question_vi": "Bản ghi nào có tiếng nhạc?",
    "filters": {
      "classes_all": [
        "music"
      ]
    },
    "support_train": 26,
    "relevance": {
      "type": "recording_ids",
      "source": "ground_truth"
    }
  },
  {
    "query_id": "q-015",
    "group": "single_class",
    "question": "Which recordings contain vacuum cleaner fan and hairdryer?",
    "question_vi": "Bản ghi nào có tiếng thiết bị gia dụng như máy hút bụi, quạt hoặc máy sấy tóc?",
    "filters": {
      "classes_all": [
        "vacuum_cleaner_fan_hairdryer"
      ]
    },
    "support_train": 24,
    "relevance": {
      "type": "recording_ids",
      "source": "ground_truth"
    }
  },
  {
    "query_id": "q-016",
    "group": "single_class",
    "question": "Which recordings contain crows seagulls and magpies?",
    "question_vi": "Bản ghi nào có tiếng chim kêu gắt như quạ, mòng biển hoặc chim ác là?",
    "filters": {
      "classes_all": [
        "crows_seagulls_magpies"
      ]
    },
    "support_train": 23,
    "relevance": {
      "type": "recording_ids",
      "source": "ground_truth"
    }
  },
  {
    "query_id": "q-017",
    "group": "single_class",
    "question": "Which recordings contain chicken coop?",
    "question_vi": "Bản ghi nào có tiếng gà trong chuồng?",
    "filters": {
      "classes_all": [
        "chicken_coop"
      ]
    },
    "support_train": 22,
    "relevance": {
      "type": "recording_ids",
      "source": "ground_truth"
    }
  },
  {
    "query_id": "q-018",
    "group": "single_class",
    "question": "Which recordings contain bells?",
    "question_vi": "Bản ghi nào có tiếng chuông?",
    "filters": {
      "classes_all": [
        "bells"
      ]
    },
    "support_train": 19,
    "relevance": {
      "type": "recording_ids",
      "source": "ground_truth"
    }
  },
  {
    "query_id": "q-019",
    "group": "single_class",
    "question": "Which recordings contain thunder fireworks and gunshot?",
    "question_vi": "Bản ghi nào có âm thanh dạng xung giống tiếng sấm, pháo hoa hoặc tiếng súng?",
    "filters": {
      "classes_all": [
        "thunder_fireworks_gunshot"
      ]
    },
    "support_train": 12,
    "relevance": {
      "type": "recording_ids",
      "source": "ground_truth"
    }
  },
  {
    "query_id": "q-020",
    "group": "single_class",
    "question": "Which recordings contain cat fight and moans?",
    "question_vi": "Bản ghi nào có tiếng mèo kêu hoặc đánh nhau?",
    "filters": {
      "classes_all": [
        "cat_fights_and_moans"
      ]
    },
    "support_train": 11,
    "relevance": {
      "type": "recording_ids",
      "source": "ground_truth"
    }
  },
  {
    "query_id": "q-021",
    "group": "single_class",
    "question": "Which recordings contain glass breaking?",
    "question_vi": "Bản ghi nào có tiếng kính vỡ?",
    "filters": {
      "classes_all": [
        "glass_breaking"
      ]
    },
    "support_train": 10,
    "relevance": {
      "type": "recording_ids",
      "source": "ground_truth"
    }
  },
  {
    "query_id": "q-022",
    "group": "multi_class",
    "question": "Which recordings contain both vehicle idling and vehicle pass-by?",
    "question_vi": "Bản ghi nào có cả tiếng động cơ xe chạy không tải và tiếng xe chạy qua?",
    "filters": {
      "classes_all": [
        "vehicle_idling",
        "vehicle_pass_by"
      ]
    },
    "support_train": 26,
    "relevance": {
      "type": "recording_ids",
      "source": "ground_truth"
    }
  },
  {
    "query_id": "q-023",
    "group": "multi_class",
    "question": "Which recordings contain both propeller aircrafts and voices?",
    "question_vi": "Bản ghi nào có cả tiếng máy bay cánh quạt hoặc trực thăng và tiếng người nói?",
    "filters": {
      "classes_all": [
        "propeller_aircrafts",
        "voices"
      ]
    },
    "support_train": 20,
    "relevance": {
      "type": "recording_ids",
      "source": "ground_truth"
    }
  },
  {
    "query_id": "q-024",
    "group": "multi_class",
    "question": "Which recordings contain both vehicle pass-by and voices?",
    "question_vi": "Bản ghi nào có cả tiếng xe chạy qua và tiếng người nói?",
    "filters": {
      "classes_all": [
        "vehicle_pass_by",
        "voices"
      ]
    },
    "support_train": 20,
    "relevance": {
      "type": "recording_ids",
      "source": "ground_truth"
    }
  },
  {
    "query_id": "q-025",
    "group": "multi_class",
    "question": "Which recordings contain both jet aircrafts and vehicle pass-by?",
    "question_vi": "Bản ghi nào có cả tiếng máy bay phản lực và tiếng xe chạy qua?",
    "filters": {
      "classes_all": [
        "jet_aircrafts",
        "vehicle_pass_by"
      ]
    },
    "support_train": 19,
    "relevance": {
      "type": "recording_ids",
      "source": "ground_truth"
    }
  },
  {
    "query_id": "q-026",
    "group": "multi_class",